[
  {
    "id": "t01-sportwagen",
    "title": "Der rote Blitz",
    "from": "broesel",
    "node": "lindenstrasse",
    "reward": 50,
    "difficulty": "leicht",
    "scenario": "sportwagen-tempo50",
    "intro": [
      ["broesel", "Junger Mann! Sind Sie das neue Amt? Dieser ROTE SPORTWAGEN rast hier jeden Morgen durch! Hier gilt Tempo 50!!!"],
      ["florian", "Ich hab ihn gefilmt und daraus das t-x-Diagramm gemacht. Jetzt brauch ich das passende t-vₓ-Diagramm."]
    ],
    "task": {
      "type": "match",
      "actor": "car",
      "given": ["anim", "xt"],
      "ask": "vt",
      "paper": "Lies im t-x-Diagramm zwei Punkte ab, berechne die Steigung und rechne sie in km/h um."
    },
    "success": [
      ["florian", "Konstante Steigung im t-x-Diagramm heißt konstante Geschwindigkeit: {v} m/s. Mal 3,6 macht das {v*3.6} km/h."],
      ["broesel", "{v*3.6} km/h? Dann ist er eben zu LEISE schnell! … Na gut. Danke, junger Mann."]
    ],
    "vary": {
      "options": [
        {
          "v": 10
        },
        {
          "v": 15
        },
        {
          "v": 20
        }
      ],
      "set": {
        "actors.car.segments.0.v": "v"
      }
    }
  },
  {
    "id": "t02-kevin",
    "title": "Bremsen durch?",
    "from": "kevin",
    "node": "fahrradladen",
    "requires": ["t01-sportwagen"],
    "reward": 60,
    "difficulty": "leicht",
    "scenario": "kevin-bremsen",
    "intro": [
      ["kevin", "Servus, Amt! Meine Bremsen fühlen sich weich an. Der Radl-Tacho hat mitgeschrieben: erst eine Schrecksekunde, dann Vollbremsung."],
      ["florian", "Das t-vₓ-Diagramm hab ich. Welches t-x-Diagramm gehört dazu?"]
    ],
    "task": {
      "type": "match",
      "actor": "kevin",
      "given": ["anim", "vt"],
      "ask": "xt",
      "paper": "Steigt oder fällt der Graph im t-x-Diagramm? Solange vₓ > 0 ist, steigt x – auch beim Bremsen, nur immer flacher. Berechne Reaktionsweg und Bremsweg als Flächen unter der t-vₓ-Kurve."
    },
    "success": [
      ["florian", "Erst gleichförmig, also eine Gerade. Dann gleichmäßig verzögert, also eine Parabel, die flach ausläuft. Anhalteweg: {v} m Reaktionsweg plus {v*v/(2*a)} m Bremsweg."],
      ["kevin", "{v+v*v/(2*a)} Meter?! Bei nur {a} m/s² Bremsverzögerung? Ich bring's sofort zum Radl-Eck. Danke, Chef!"]
    ],
    "vary": {
      "options": [
        {
          "v": 8,
          "a": 2
        },
        {
          "v": 6,
          "a": 1.5
        },
        {
          "v": 10,
          "a": 2.5
        }
      ],
      "set": {
        "actors.kevin.segments.0.v": "v",
        "actors.kevin.segments.1.a": "-a"
      }
    }
  },
  {
    "id": "t03-bus",
    "title": "Ruckelt der Bus?",
    "from": "oetzi",
    "node": "bushof",
    "requires": ["t02-kevin"],
    "reward": 70,
    "difficulty": "leicht",
    "scenario": "bus-anfahren",
    "intro": [
      ["oetzi", "Griaß di! Die Fahrgäste beschweren sich übers Ruckeln. Ich sag: Ich fahr wie a Feder!"],
      ["florian", "Im t-vₓ-Diagramm ist die Beschleunigung die Steigung. Welches t-aₓ-Diagramm passt?"]
    ],
    "task": {
      "type": "match",
      "actor": "bus",
      "given": ["anim", "vt"],
      "ask": "at",
      "paper": "Berechne für jeden Abschnitt die Steigung Δvₓ/Δt im t-vₓ-Diagramm."
    },
    "success": [
      ["florian", "Anfahren mit 1,5 m/s², dann gleichförmig, dann Bremsen mit −3,0 m/s². Das Bremsen ist doppelt so heftig wie das Anfahren."],
      ["oetzi", "Ah geh. Also doch ich. Ab morgen brems ich früher."]
    ]
  },
  {
    "id": "t04-brezel",
    "title": "Der Hund, der zurückläuft",
    "from": "baecker",
    "node": "baeckerei",
    "requires": ["t01-sportwagen"],
    "reward": 60,
    "difficulty": "leicht",
    "scenario": "hund-brezel",
    "intro": [
      ["baecker", "Herr Amt! Mein Hund Brezel rennt jeden Morgen zum Laternenpfahl, dann ein Stück zurück, und dann bleibt er stehen und schaut blöd. Ist das normal?"],
      ["florian", "Ob das normal ist, weiß ich nicht. Aber ich kann es als t-x-Diagramm aufschreiben."]
    ],
    "task": {
      "type": "match",
      "actor": "dog",
      "given": ["anim"],
      "ask": "xt"
    },
    "success": [
      ["florian", "4,0 s mit 3,0 m/s nach vorn, 3,0 s mit 2,0 m/s zurück, dann 2,0 s Stillstand. Er endet 6,0 m vom Start, ist aber 18 m gelaufen."],
      ["baecker", "18 Meter für nix. Wie mein Lehrling."]
    ]
  },
  {
    "id": "t05-radeln",
    "title": "Partnerschafts-Radeln",
    "from": "kranz",
    "node": "park",
    "requires": ["t01-sportwagen"],
    "reward": 80,
    "difficulty": "mittel",
    "scenario": "radeln-partnerstadt",
    "intro": [
      ["kranz", "Herr Doktor Brandl! Morgen ist Partnerschafts-Radeln mit Unterbach. Anna startet bei uns, Bernd gleichzeitig in Unterbach, 3,0 km entfernt."],
      ["kranz", "Ich muss wissen, WANN und WO sie sich treffen. Da stelle ich das Rednerpult hin. Und die Blaskapelle."],
      ["florian", "Zwei Bewegungsgleichungen, einmal gleichsetzen. Das krieg ich hin."]
    ],
    "task": {
      "type": "calc",
      "given": ["anim", "data"],
      "prompt": "Wann und wo treffen sich Anna und Bernd?",
      "paper": "Stelle für beide x(t) = x₀ + vₓ·t auf, setze die Gleichungen gleich und löse nach t auf. Den Treffzeitpunkt kannst du zur Kontrolle auch in der Animation ablesen – den Ort aber bitte berechnen: t in eine der Gleichungen einsetzen. Achtung: Den Ort gibst du in km an!",
      "questions": [
        {
          "label": "Treffzeitpunkt",
          "symbol": "t_T",
          "unit": "s",
          "goal": {
            "type": "meet",
            "a": "anna",
            "b": "bernd",
            "ask": "t"
          },
          "hints": [
            {
              "value": "{3000/va}",
              "text": "Das wäre die Zeit, die Anna allein für die ganzen 3,0 km bräuchte. Beide fahren aber gleichzeitig aufeinander zu."
            },
            {
              "value": "{3000/vb}",
              "text": "Das ist Bernds Zeit für die ganze Strecke. Beide fahren aber gleichzeitig los."
            },
            {
              "value": "{3000/max(abs(vb-va),0.001)}",
              "text": "Hast du die Geschwindigkeiten subtrahiert statt addiert? Bernd fährt in negative Richtung, vₓ ist also negativ."
            }
          ],
          "help": "Setze {va} m/s · t = 3000 m − {vb} m/s · t und löse nach t auf."
        },
        {
          "label": "Treffpunkt (Ort)",
          "symbol": "x_T",
          "unit": "km",
          "goal": {
            "type": "meet",
            "a": "anna",
            "b": "bernd",
            "ask": "x"
          },
          "hints": [
            {
              "value": "{3*vb/(va+vb)}",
              "text": "Das ist die Strecke, die Bernd gefahren ist. Gefragt ist der Ort x, gemessen von Annas Start."
            },
            {
              "value": "{3000*va/(va+vb)}",
              "text": "Der Wert stimmt – aber in Metern. Gefragt ist der Ort in km: 1 km = 1000 m.",
              "tol": 50
            },
            {
              "value": 1.5,
              "text": "Die Mitte wäre es nur bei gleichen Geschwindigkeiten."
            }
          ],
          "help": "Setze t_T in Annas Gleichung x(t) = {va} m/s · t ein und rechne das Ergebnis in km um."
        }
      ]
    },
    "success": [
      ["florian", "Nach {3000/(va+vb)} s, also {50/(va+vb)} Minuten, bei x = {3*va/(va+vb)} km. Wer schneller fährt, legt bis zum Treffen mehr Weg zurück."],
      ["kranz", "{3*va/(va+vb)} Kilometer von uns! Wunderbar! Dann weiß die Blaskapelle, wohin."]
    ],
    "vary": {
      "options": [
        {
          "va": 5,
          "vb": 7.5
        },
        {
          "va": 4,
          "vb": 6
        },
        {
          "va": 6,
          "vb": 4
        },
        {
          "va": 5,
          "vb": 5
        }
      ],
      "set": {
        "actors.anna.segments.0.v": "va",
        "actors.bernd.segments.0.v": "-vb"
      }
    }
  },
  {
    "id": "t06-broesel-ampel",
    "title": "Frau Brösels Rache",
    "from": "broesel",
    "node": "lindenstrasse",
    "requires": ["t03-bus", "t05-radeln"],
    "reward": 90,
    "difficulty": "schwer",
    "scenario": "sportwagen-ampel",
    "intro": [
      ["broesel", "DA sind Sie ja! Der rote Sportwagen war heute wieder da! Erst hat er an der Ampel gehalten, und dann ist er wieder losgerast!"],
      ["broesel", "Und er ist sicher über 50 gefahren! Diesmal hab ich Beweise!"],
      ["florian", "Ich hab sein t-vₓ-Diagramm von der Ampelkamera. Schauen wir mal genau hin."]
    ],
    "task": {
      "type": "calc",
      "given": ["anim", "vt"],
      "ruler": false,
      "prompt": "Werte das t-vₓ-Diagramm aus.",
      "paper": "Gesamtweg = Fläche unter der t-vₓ-Kurve (Rechtecke, Dreiecke). Durchschnittsgeschwindigkeit = Gesamtweg / Gesamtzeit. Umrechnen: 1 m/s = 3,6 km/h.",
      "questions": [
        {
          "label": "Gesamtweg",
          "symbol": "s",
          "unit": "m",
          "goal": {
            "type": "totalPath",
            "actor": "car"
          },
          "range": [550, 650],
          "hints": [
            {
              "value": 510,
              "text": "Du hast nur die Abschnitte mit konstanter Geschwindigkeit gezählt. Auch beim Bremsen und Anfahren legt das Auto Weg zurück (Dreiecke!)."
            },
            {
              "value": 1050,
              "text": "Rechne die Fläche abschnittsweise. Während das Auto steht, legt es keinen Weg zurück."
            }
          ],
          "help": "Fünf Abschnitte: Rechteck 20 s · 15 m/s, Dreieck beim Bremsen, Stillstand, Dreieck beim Anfahren, Rechteck 14 s · 15 m/s."
        },
        {
          "label": "Durchschnittsgeschwindigkeit",
          "symbol": "v̄",
          "unit": "km/h",
          "goal": {
            "type": "avgSpeed",
            "actor": "car"
          },
          "range": [28, 34],
          "follows": { "q": 0, "var": "s", "expr": "s/70*3.6" },